{
  "bindings": {
    "budget_manifest_sha256": "CB25C10A05A0368A10435098B08CED0EFA05F720F7FEDCCD930B14844863977D",
    "config_frozen_sha256": "444F67F57F2BADBD74B37D4AA9AEE4CB8ACB341A51012F50E5F1ACD232EEF610",
    "final_data_manifest_sha256": "76DA37CF6CAADEC27DB97A39E7874062182C040193AA998703BD83503ED2550D",
    "preregistration_sha256": "990278BA35CE8020059C0309A46A498946D3DA9E2E1E4A1F1F868C67C2F8F2AE",
    "primary_raw_validation_sha256": "03023C05CD853A8277967DFEF6441C97FA9CABB44349AB0B32AE1E37B9284F71"
  },
  "decision": {
    "positive_composition_confirmation": true,
    "status": "POSITIVE_COMPOSITION_CONFIRMATION"
  },
  "descriptive_non_gating": {
    "atomic_forgetting": {
      "0": {
        "atomic_control": {
          "drops": {
            "apply_AC1": 0.0,
            "apply_AX1": 0.0,
            "apply_REV": 0.0,
            "apply_SC2": 0.0,
            "apply_SH1": 0.11999999999999994,
            "plan": 0.0010000000000000009,
            "plan_AC1": 0.0,
            "plan_AX1": 0.0,
            "plan_REV": 0.0,
            "plan_SC2": 0.0,
            "plan_SH1": 0.0050000000000000044
          },
          "gating": false,
          "max_drop": 0.11999999999999994,
          "passes_le_002": false
        },
        "composition_distill": {
          "drops": {
            "apply_AC1": 0.0,
            "apply_AX1": 0.0,
            "apply_REV": 0.0,
            "apply_SC2": 0.0050000000000000044,
            "apply_SH1": 0.36,
            "plan": 0.027000000000000024,
            "plan_AC1": 0.0,
            "plan_AX1": 0.0,
            "plan_REV": 0.06000000000000005,
            "plan_SC2": 0.0050000000000000044,
            "plan_SH1": 0.06999999999999995
          },
          "gating": false,
          "max_drop": 0.36,
          "passes_le_002": false
        }
      },
      "1": {
        "atomic_control": {
          "drops": {
            "apply_AC1": 0.0,
            "apply_AX1": 0.0,
            "apply_REV": 0.0,
            "apply_SC2": 0.0,
            "apply_SH1": 0.019999999999999907,
            "plan": 0.0010000000000000009,
            "plan_AC1": 0.0,
            "plan_AX1": 0.0,
            "plan_REV": 0.0,
            "plan_SC2": 0.0,
            "plan_SH1": 0.0050000000000000044
          },
          "gating": false,
          "max_drop": 0.019999999999999907,
          "passes_le_002": true
        },
        "composition_distill": {
          "drops": {
            "apply_AC1": 0.0,
            "apply_AX1": 0.0,
            "apply_REV": 0.0,
            "apply_SC2": 0.0050000000000000044,
            "apply_SH1": 0.30499999999999994,
            "plan": 0.02400000000000002,
            "plan_AC1": 0.0,
            "plan_AX1": 0.0,
            "plan_REV": 0.06000000000000005,
            "plan_SC2": 0.010000000000000009,
            "plan_SH1": 0.050000000000000044
          },
          "gating": false,
          "max_drop": 0.30499999999999994,
          "passes_le_002": false
        }
      },
      "2": {
        "atomic_control": {
          "drops": {
            "apply_AC1": 0.0,
            "apply_AX1": 0.0,
            "apply_REV": 0.0,
            "apply_SC2": 0.0,
            "apply_SH1": 0.04499999999999993,
            "plan": 0.0010000000000000009,
            "plan_AC1": 0.0,
            "plan_AX1": 0.0,
            "plan_REV": 0.0,
            "plan_SC2": 0.0,
            "plan_SH1": 0.0050000000000000044
          },
          "gating": false,
          "max_drop": 0.04499999999999993,
          "passes_le_002": false
        },
        "composition_distill": {
          "drops": {
            "apply_AC1": 0.0,
            "apply_AX1": 0.0,
            "apply_REV": 0.0,
            "apply_SC2": 0.0050000000000000044,
            "apply_SH1": 0.29499999999999993,
            "plan": 0.013000000000000012,
            "plan_AC1": 0.0,
            "plan_AX1": 0.0,
            "plan_REV": 0.025000000000000022,
            "plan_SC2": 0.010000000000000009,
            "plan_SH1": 0.030000000000000027
          },
          "gating": false,
          "max_drop": 0.29499999999999993,
          "passes_le_002": false
        }
      },
      "3": {
        "atomic_control": {
          "drops": {
            "apply_AC1": 0.0,
            "apply_AX1": 0.0,
            "apply_REV": 0.0,
            "apply_SC2": 0.0050000000000000044,
            "apply_SH1": 0.11999999999999994,
            "plan": 0.0010000000000000009,
            "plan_AC1": 0.0,
            "plan_AX1": 0.0,
            "plan_REV": 0.0,
            "plan_SC2": 0.0,
            "plan_SH1": 0.0050000000000000044
          },
          "gating": false,
          "max_drop": 0.11999999999999994,
          "passes_le_002": false
        },
        "composition_distill": {
          "drops": {
            "apply_AC1": 0.0,
            "apply_AX1": 0.0,
            "apply_REV": 0.0,
            "apply_SC2": 0.0050000000000000044,
            "apply_SH1": 0.25999999999999995,
            "plan": 0.019000000000000017,
            "plan_AC1": 0.0,
            "plan_AX1": 0.0,
            "plan_REV": 0.010000000000000009,
            "plan_SC2": 0.015000000000000013,
            "plan_SH1": 0.06999999999999995
          },
          "gating": false,
          "max_drop": 0.25999999999999995,
          "passes_le_002": false
        }
      },
      "4": {
        "atomic_control": {
          "drops": {
            "apply_AC1": 0.0,
            "apply_AX1": 0.0,
            "apply_REV": 0.0,
            "apply_SC2": 0.0,
            "apply_SH1": 0.019999999999999907,
            "plan": 0.0010000000000000009,
            "plan_AC1": 0.0,
            "plan_AX1": 0.0,
            "plan_REV": 0.0,
            "plan_SC2": 0.0,
            "plan_SH1": 0.0050000000000000044
          },
          "gating": false,
          "max_drop": 0.019999999999999907,
          "passes_le_002": true
        },
        "composition_distill": {
          "drops": {
            "apply_AC1": 0.0,
            "apply_AX1": 0.0,
            "apply_REV": 0.0,
            "apply_SC2": 0.010000000000000009,
            "apply_SH1": 0.24499999999999994,
            "plan": 0.01200000000000001,
            "plan_AC1": 0.0,
            "plan_AX1": 0.0,
            "plan_REV": 0.0050000000000000044,
            "plan_SC2": 0.0050000000000000044,
            "plan_SH1": 0.050000000000000044
          },
          "gating": false,
          "max_drop": 0.24499999999999994,
          "passes_le_002": false
        }
      },
      "5": {
        "atomic_control": {
          "drops": {
            "apply_AC1": 0.0,
            "apply_AX1": 0.0,
            "apply_REV": 0.0,
            "apply_SC2": 0.0,
            "apply_SH1": 0.03499999999999992,
            "plan": 0.0,
            "plan_AC1": 0.0,
            "plan_AX1": 0.0,
            "plan_REV": 0.0,
            "plan_SC2": 0.0,
            "plan_SH1": 0.0
          },
          "gating": false,
          "max_drop": 0.03499999999999992,
          "passes_le_002": false
        },
        "composition_distill": {
          "drops": {
            "apply_AC1": 0.0,
            "apply_AX1": 0.0,
            "apply_REV": 0.0,
            "apply_SC2": 0.0050000000000000044,
            "apply_SH1": 0.23999999999999994,
            "plan": 0.026000000000000023,
            "plan_AC1": 0.0,
            "plan_AX1": 0.0,
            "plan_REV": 0.06499999999999995,
            "plan_SC2": 0.010000000000000009,
            "plan_SH1": 0.05499999999999994
          },
          "gating": false,
          "max_drop": 0.23999999999999994,
          "passes_le_002": false
        }
      }
    },
    "correct_mass_seed_deltas": {
      "0": 0.042677079995838946,
      "1": 0.04366091863718363,
      "2": 0.04271383919739656,
      "3": 0.04420705086051978,
      "4": 0.04464347664765217,
      "5": 0.04682461214103231
    },
    "historical_dev_b_delta": -0.176
  },
  "integrity": {
    "all_six_replicates_complete": true,
    "budget_manifest_bound": true,
    "equal_budget_valid": true,
    "full_raw_rankings_valid": true,
    "full_raw_validation_sha256": "513BF4D3593DAC3A232F4405C36029002D411623488682B436B50DF046BF227C",
    "leakage_count": 0,
    "pass": true,
    "raw_rankings_valid": true,
    "same_tasks_across_branches_and_seeds": true
  },
  "primary": {
    "criteria": {
      "checks": {
        "mean_delta_ge_005": true,
        "positive_seeds_ge_5_of_6": true,
        "t_ci_lower_gt_0": true,
        "t_p_two_sided_lt_005": true
      },
      "composition_effect_pass": true
    },
    "endpoint": {
      "baseline": "atomic_control",
      "depth": 3,
      "metric": "hit@32",
      "n_tasks_per_seed": 1000,
      "split": "final_a",
      "treatment": "composition_distill"
    },
    "exact_sign_flip": {
      "alternative": "two_sided",
      "extreme_count": 2,
      "gating": false,
      "minimum_attainable_p": 0.03125,
      "p_denominator": 32,
      "p_numerator": 1,
      "p_two_sided": 0.03125,
      "permutations": 64,
      "statistic": "absolute_mean_seed_delta",
      "ties": "included"
    },
    "per_seed": [
      {
        "both_hit": 305,
        "control_hits": 435,
        "control_only": 130,
        "delta": 0.302,
        "delta_denominator": 1000,
        "delta_numerator": 302,
        "delta_pp": 30.2,
        "distill_hits": 737,
        "distill_only": 432,
        "neither": 133,
        "replicate_label": 0
      },
      {
        "both_hit": 316,
        "control_hits": 457,
        "control_only": 141,
        "delta": 0.267,
        "delta_denominator": 1000,
        "delta_numerator": 267,
        "delta_pp": 26.700000000000003,
        "distill_hits": 724,
        "distill_only": 408,
        "neither": 135,
        "replicate_label": 1
      },
      {
        "both_hit": 305,
        "control_hits": 454,
        "control_only": 149,
        "delta": 0.26,
        "delta_denominator": 1000,
        "delta_numerator": 260,